# Runs

## 20250817.pkl


Best params:
- initial_q: -0.6374781608899868
- learning_rate: 0.021974521773962988
- learning_rate_mode: fixed
- discount: 0.7603525592096564

### Output
```
[Chunk 1] Evaluating agent with 30 rounds...
Loading model from saved state.
100%|████████████████████████████████████████████████████████████████████████████████████████████████████████████████| 30/30 [00:09<00:00,  3.19it/s]
[Chunk 1] Evaluation stats saved to agent_code/tq_optuna/dicts/eval_chunk_0001.json
Training complete.
[I 2025-08-17 16:17:55,451] Trial 0 finished with value: 0.03333333333333333 and parameters: {'initial_q': 0.21367172855477112, 'learning_rate': 9.465370544917075e-05, 'learning_rate_mode': 'adaptive', 'discount': 0.7194501709355107}. Best is trial 0 with value: 0.03333333333333333.
Loaded 50000 episodes from 1 file(s).
50000 episodes remaining. Visited 0 states
[Chunk 1] Saved single-archive snapshot to agent_code/tq_optuna/dicts/q_table_chunk_0001.npz
[Chunk 1] Evaluating agent with 30 rounds...
Loading model from saved state.
100%|████████████████████████████████████████████████████████████████████████████████████████████████████████████████| 30/30 [00:17<00:00,  1.68it/s]
[Chunk 1] Evaluation stats saved to agent_code/tq_optuna/dicts/eval_chunk_0001.json
Training complete.
[I 2025-08-17 16:19:17,199] Trial 1 finished with value: 0.0 and parameters: {'initial_q': 0.36171652742010973, 'learning_rate': 0.004529926247474389, 'learning_rate_mode': 'fixed', 'discount': 0.6355979698201221}. Best is trial 0 with value: 0.03333333333333333.
Loaded 50000 episodes from 1 file(s).
50000 episodes remaining. Visited 0 states
[Chunk 1] Saved single-archive snapshot to agent_code/tq_optuna/dicts/q_table_chunk_0001.npz
[Chunk 1] Evaluating agent with 30 rounds...
Loading model from saved state.
100%|████████████████████████████████████████████████████████████████████████████████████████████████████████████████| 30/30 [00:11<00:00,  2.56it/s]
[Chunk 1] Evaluation stats saved to agent_code/tq_optuna/dicts/eval_chunk_0001.json
Training complete.
[I 2025-08-17 16:20:51,336] Trial 2 finished with value: 0.5333333333333333 and parameters: {'initial_q': 0.2621667201733606, 'learning_rate': 0.001262357993990628, 'learning_rate_mode': 'adaptive', 'discount': 0.8988646717159443}. Best is trial 2 with value: 0.5333333333333333.
Loaded 50000 episodes from 1 file(s).
50000 episodes remaining. Visited 0 states
[Chunk 1] Saved single-archive snapshot to agent_code/tq_optuna/dicts/q_table_chunk_0001.npz
[Chunk 1] Evaluating agent with 30 rounds...
Loading model from saved state.
100%|████████████████████████████████████████████████████████████████████████████████████████████████████████████████| 30/30 [00:10<00:00,  2.92it/s]
[Chunk 1] Evaluation stats saved to agent_code/tq_optuna/dicts/eval_chunk_0001.json
Training complete.
[I 2025-08-17 16:22:06,732] Trial 3 finished with value: 4.066666666666666 and parameters: {'initial_q': -0.4994114472826934, 'learning_rate': 0.03915215716318081, 'learning_rate_mode': 'fixed', 'discount': 0.690345711013518}. Best is trial 3 with value: 4.066666666666666.
Loaded 50000 episodes from 1 file(s).
50000 episodes remaining. Visited 0 states
[Chunk 1] Saved single-archive snapshot to agent_code/tq_optuna/dicts/q_table_chunk_0001.npz
[Chunk 1] Evaluating agent with 30 rounds...
Loading model from saved state.
100%|████████████████████████████████████████████████████████████████████████████████████████████████████████████████| 30/30 [00:09<00:00,  3.31it/s]
[Chunk 1] Evaluation stats saved to agent_code/tq_optuna/dicts/eval_chunk_0001.json
Training complete.
[I 2025-08-17 16:23:29,191] Trial 4 finished with value: 5.133333333333334 and parameters: {'initial_q': -0.4145141374789041, 'learning_rate': 0.020922767169988317, 'learning_rate_mode': 'adaptive', 'discount': 0.543118468420042}. Best is trial 4 with value: 5.133333333333334.
Loaded 50000 episodes from 1 file(s).
50000 episodes remaining. Visited 0 states
[Chunk 1] Saved single-archive snapshot to agent_code/tq_optuna/dicts/q_table_chunk_0001.npz
[Chunk 1] Evaluating agent with 30 rounds...
Loading model from saved state.
100%|████████████████████████████████████████████████████████████████████████████████████████████████████████████████| 30/30 [00:15<00:00,  1.97it/s]
[Chunk 1] Evaluation stats saved to agent_code/tq_optuna/dicts/eval_chunk_0001.json
Training complete.
[I 2025-08-17 16:24:46,135] Trial 5 finished with value: 3.566666666666667 and parameters: {'initial_q': -0.24271268029678406, 'learning_rate': 0.0006214231365833768, 'learning_rate_mode': 'fixed', 'discount': 0.8077134813411997}. Best is trial 4 with value: 5.133333333333334.
Loaded 50000 episodes from 1 file(s).
50000 episodes remaining. Visited 0 states
[Chunk 1] Saved single-archive snapshot to agent_code/tq_optuna/dicts/q_table_chunk_0001.npz
[Chunk 1] Evaluating agent with 30 rounds...
Loading model from saved state.
100%|████████████████████████████████████████████████████████████████████████████████████████████████████████████████| 30/30 [00:09<00:00,  3.07it/s]
[Chunk 1] Evaluation stats saved to agent_code/tq_optuna/dicts/eval_chunk_0001.json
Training complete.
[I 2025-08-17 16:25:55,301] Trial 6 finished with value: 0.16666666666666666 and parameters: {'initial_q': 0.6163714568296326, 'learning_rate': 0.007224787224853257, 'learning_rate_mode': 'fixed', 'discount': 0.8757471050756309}. Best is trial 4 with value: 5.133333333333334.
Loaded 50000 episodes from 1 file(s).
50000 episodes remaining. Visited 0 states
[Chunk 1] Saved single-archive snapshot to agent_code/tq_optuna/dicts/q_table_chunk_0001.npz
[Chunk 1] Evaluating agent with 30 rounds...
Loading model from saved state.
100%|████████████████████████████████████████████████████████████████████████████████████████████████████████████████| 30/30 [00:14<00:00,  2.10it/s]
[Chunk 1] Evaluation stats saved to agent_code/tq_optuna/dicts/eval_chunk_0001.json
Training complete.
[I 2025-08-17 16:27:09,089] Trial 7 finished with value: 0.16666666666666666 and parameters: {'initial_q': 0.6050727379295227, 'learning_rate': 0.0006916480040291753, 'learning_rate_mode': 'fixed', 'discount': 0.6982040840681207}. Best is trial 4 with value: 5.133333333333334.
Loaded 50000 episodes from 1 file(s).
50000 episodes remaining. Visited 0 states
[Chunk 1] Saved single-archive snapshot to agent_code/tq_optuna/dicts/q_table_chunk_0001.npz
[Chunk 1] Evaluating agent with 30 rounds...
Loading model from saved state.
100%|████████████████████████████████████████████████████████████████████████████████████████████████████████████████| 30/30 [00:07<00:00,  3.82it/s]
[Chunk 1] Evaluation stats saved to agent_code/tq_optuna/dicts/eval_chunk_0001.json
Training complete.
[I 2025-08-17 16:28:30,354] Trial 8 finished with value: 0.36666666666666664 and parameters: {'initial_q': 0.07530356900825175, 'learning_rate': 0.01534905073991997, 'learning_rate_mode': 'adaptive', 'discount': 0.7890460084456509}. Best is trial 4 with value: 5.133333333333334.
Loaded 50000 episodes from 1 file(s).
50000 episodes remaining. Visited 0 states
[Chunk 1] Saved single-archive snapshot to agent_code/tq_optuna/dicts/q_table_chunk_0001.npz
[Chunk 1] Evaluating agent with 30 rounds...
Loading model from saved state.
100%|████████████████████████████████████████████████████████████████████████████████████████████████████████████████| 30/30 [00:16<00:00,  1.79it/s]
[Chunk 1] Evaluation stats saved to agent_code/tq_optuna/dicts/eval_chunk_0001.json
Training complete.
[I 2025-08-17 16:30:06,290] Trial 9 finished with value: 0.43333333333333335 and parameters: {'initial_q': 0.5609225435546807, 'learning_rate': 0.03919587172123217, 'learning_rate_mode': 'adaptive', 'discount': 0.9301149242667316}. Best is trial 4 with value: 5.133333333333334.
Loaded 50000 episodes from 1 file(s).
50000 episodes remaining. Visited 0 states
[Chunk 1] Saved single-archive snapshot to agent_code/tq_optuna/dicts/q_table_chunk_0001.npz
[Chunk 1] Evaluating agent with 30 rounds...
Loading model from saved state.
100%|████████████████████████████████████████████████████████████████████████████████████████████████████████████████| 30/30 [00:14<00:00,  2.13it/s]
[Chunk 1] Evaluation stats saved to agent_code/tq_optuna/dicts/eval_chunk_0001.json
Training complete.
[I 2025-08-17 16:31:41,842] Trial 10 finished with value: 3.8333333333333335 and parameters: {'initial_q': -0.9935864102455028, 'learning_rate': 1.076430556373747e-05, 'learning_rate_mode': 'adaptive', 'discount': 0.5136934817331362}. Best is trial 4 with value: 5.133333333333334.
Loaded 50000 episodes from 1 file(s).
50000 episodes remaining. Visited 0 states
[Chunk 1] Saved single-archive snapshot to agent_code/tq_optuna/dicts/q_table_chunk_0001.npz
[Chunk 1] Evaluating agent with 30 rounds...
Loading model from saved state.
100%|████████████████████████████████████████████████████████████████████████████████████████████████████████████████| 30/30 [00:09<00:00,  3.04it/s]
[Chunk 1] Evaluation stats saved to agent_code/tq_optuna/dicts/eval_chunk_0001.json
Training complete.
[I 2025-08-17 16:32:51,528] Trial 11 finished with value: 2.3666666666666667 and parameters: {'initial_q': -0.5264254301660102, 'learning_rate': 0.09607637350805372, 'learning_rate_mode': 'fixed', 'discount': 0.5254120739449876}. Best is trial 4 with value: 5.133333333333334.
Loaded 50000 episodes from 1 file(s).
50000 episodes remaining. Visited 0 states
[Chunk 1] Saved single-archive snapshot to agent_code/tq_optuna/dicts/q_table_chunk_0001.npz
[Chunk 1] Evaluating agent with 30 rounds...
Loading model from saved state.
100%|████████████████████████████████████████████████████████████████████████████████████████████████████████████████| 30/30 [00:08<00:00,  3.63it/s]
[Chunk 1] Evaluation stats saved to agent_code/tq_optuna/dicts/eval_chunk_0001.json
Training complete.
[I 2025-08-17 16:34:00,172] Trial 12 finished with value: 3.466666666666667 and parameters: {'initial_q': -0.5441097076027934, 'learning_rate': 0.08461361325616644, 'learning_rate_mode': 'fixed', 'discount': 0.6140071924811377}. Best is trial 4 with value: 5.133333333333334.
Loaded 50000 episodes from 1 file(s).
50000 episodes remaining. Visited 0 states
[Chunk 1] Saved single-archive snapshot to agent_code/tq_optuna/dicts/q_table_chunk_0001.npz
[Chunk 1] Evaluating agent with 30 rounds...
Loading model from saved state.
100%|████████████████████████████████████████████████████████████████████████████████████████████████████████████████| 30/30 [00:12<00:00,  2.37it/s]
[Chunk 1] Evaluation stats saved to agent_code/tq_optuna/dicts/eval_chunk_0001.json
Training complete.
[I 2025-08-17 16:35:32,094] Trial 13 finished with value: 3.3333333333333335 and parameters: {'initial_q': -0.3008266568931375, 'learning_rate': 0.021636539306187124, 'learning_rate_mode': 'adaptive', 'discount': 0.6017783646671727}. Best is trial 4 with value: 5.133333333333334.
Loaded 50000 episodes from 1 file(s).
50000 episodes remaining. Visited 0 states
[Chunk 1] Saved single-archive snapshot to agent_code/tq_optuna/dicts/q_table_chunk_0001.npz
[Chunk 1] Evaluating agent with 30 rounds...
Loading model from saved state.
100%|████████████████████████████████████████████████████████████████████████████████████████████████████████████████| 30/30 [00:04<00:00,  6.13it/s]
[Chunk 1] Evaluation stats saved to agent_code/tq_optuna/dicts/eval_chunk_0001.json
Training complete.
[I 2025-08-17 16:36:50,850] Trial 14 finished with value: 2.566666666666667 and parameters: {'initial_q': -0.970757704355929, 'learning_rate': 0.003722320680707993, 'learning_rate_mode': 'adaptive', 'discount': 0.5680945068155167}. Best is trial 4 with value: 5.133333333333334.
Loaded 50000 episodes from 1 file(s).
50000 episodes remaining. Visited 0 states
[Chunk 1] Saved single-archive snapshot to agent_code/tq_optuna/dicts/q_table_chunk_0001.npz
[Chunk 1] Evaluating agent with 30 rounds...
Loading model from saved state.
100%|████████████████████████████████████████████████████████████████████████████████████████████████████████████████| 30/30 [00:10<00:00,  2.93it/s]
[Chunk 1] Evaluation stats saved to agent_code/tq_optuna/dicts/eval_chunk_0001.json
Training complete.
[I 2025-08-17 16:37:57,706] Trial 15 finished with value: 0.0 and parameters: {'initial_q': 0.9790184067968191, 'learning_rate': 0.01435805016556843, 'learning_rate_mode': 'fixed', 'discount': 0.6688119925941959}. Best is trial 4 with value: 5.133333333333334.
Loaded 50000 episodes from 1 file(s).
50000 episodes remaining. Visited 0 states
[Chunk 1] Saved single-archive snapshot to agent_code/tq_optuna/dicts/q_table_chunk_0001.npz
[Chunk 1] Evaluating agent with 30 rounds...
Loading model from saved state.
100%|████████████████████████████████████████████████████████████████████████████████████████████████████████████████| 30/30 [00:06<00:00,  4.72it/s]
[Chunk 1] Evaluation stats saved to agent_code/tq_optuna/dicts/eval_chunk_0001.json
Training complete.
[I 2025-08-17 16:39:21,057] Trial 16 finished with value: 1.8 and parameters: {'initial_q': -0.6982808498833942, 'learning_rate': 0.00017172457897357633, 'learning_rate_mode': 'adaptive', 'discount': 0.9821161877067364}. Best is trial 4 with value: 5.133333333333334.
Loaded 50000 episodes from 1 file(s).
50000 episodes remaining. Visited 0 states
[Chunk 1] Saved single-archive snapshot to agent_code/tq_optuna/dicts/q_table_chunk_0001.npz
[Chunk 1] Evaluating agent with 30 rounds...
Loading model from saved state.
100%|████████████████████████████████████████████████████████████████████████████████████████████████████████████████| 30/30 [00:09<00:00,  3.23it/s]
[Chunk 1] Evaluation stats saved to agent_code/tq_optuna/dicts/eval_chunk_0001.json
Training complete.
[I 2025-08-17 16:40:28,949] Trial 17 finished with value: 3.2666666666666666 and parameters: {'initial_q': -0.12207139513390655, 'learning_rate': 0.0440049781634822, 'learning_rate_mode': 'fixed', 'discount': 0.7701950675729152}. Best is trial 4 with value: 5.133333333333334.
Loaded 50000 episodes from 1 file(s).
50000 episodes remaining. Visited 0 states
[Chunk 1] Saved single-archive snapshot to agent_code/tq_optuna/dicts/q_table_chunk_0001.npz
[Chunk 1] Evaluating agent with 30 rounds...
Loading model from saved state.
100%|████████████████████████████████████████████████████████████████████████████████████████████████████████████████| 30/30 [00:11<00:00,  2.55it/s]
[Chunk 1] Evaluation stats saved to agent_code/tq_optuna/dicts/eval_chunk_0001.json
Training complete.
[I 2025-08-17 16:42:02,987] Trial 18 finished with value: 4.733333333333333 and parameters: {'initial_q': -0.6844537925979399, 'learning_rate': 0.001990496609294182, 'learning_rate_mode': 'adaptive', 'discount': 0.5560062975667796}. Best is trial 4 with value: 5.133333333333334.
Loaded 50000 episodes from 1 file(s).
50000 episodes remaining. Visited 0 states
[Chunk 1] Saved single-archive snapshot to agent_code/tq_optuna/dicts/q_table_chunk_0001.npz
[Chunk 1] Evaluating agent with 30 rounds...
Loading model from saved state.
100%|████████████████████████████████████████████████████████████████████████████████████████████████████████████████| 30/30 [00:09<00:00,  3.09it/s]
[Chunk 1] Evaluation stats saved to agent_code/tq_optuna/dicts/eval_chunk_0001.json
Training complete.
[I 2025-08-17 16:43:35,854] Trial 19 finished with value: 2.5 and parameters: {'initial_q': -0.776654885686973, 'learning_rate': 0.002334287189726053, 'learning_rate_mode': 'adaptive', 'discount': 0.5508821105632659}. Best is trial 4 with value: 5.133333333333334.
Loaded 50000 episodes from 1 file(s).
50000 episodes remaining. Visited 0 states
[Chunk 1] Saved single-archive snapshot to agent_code/tq_optuna/dicts/q_table_chunk_0001.npz
[Chunk 1] Evaluating agent with 30 rounds...
Loading model from saved state.
100%|████████████████████████████████████████████████████████████████████████████████████████████████████████████████| 30/30 [00:14<00:00,  2.08it/s]
[Chunk 1] Evaluation stats saved to agent_code/tq_optuna/dicts/eval_chunk_0001.json
Training complete.
[I 2025-08-17 16:45:08,159] Trial 20 finished with value: 3.9 and parameters: {'initial_q': -0.313720504223859, 'learning_rate': 0.00024647706311988653, 'learning_rate_mode': 'adaptive', 'discount': 0.5616697172996981}. Best is trial 4 with value: 5.133333333333334.
Loaded 50000 episodes from 1 file(s).
50000 episodes remaining. Visited 0 states
[Chunk 1] Saved single-archive snapshot to agent_code/tq_optuna/dicts/q_table_chunk_0001.npz
[Chunk 1] Evaluating agent with 30 rounds...
Loading model from saved state.
100%|████████████████████████████████████████████████████████████████████████████████████████████████████████████████| 30/30 [00:06<00:00,  4.65it/s]
[Chunk 1] Evaluation stats saved to agent_code/tq_optuna/dicts/eval_chunk_0001.json
Training complete.
[I 2025-08-17 16:46:29,982] Trial 21 finished with value: 2.3333333333333335 and parameters: {'initial_q': -0.5043211702216077, 'learning_rate': 0.00830182351712575, 'learning_rate_mode': 'adaptive', 'discount': 0.6559007197871473}. Best is trial 4 with value: 5.133333333333334.
Loaded 50000 episodes from 1 file(s).
50000 episodes remaining. Visited 0 states
[Chunk 1] Saved single-archive snapshot to agent_code/tq_optuna/dicts/q_table_chunk_0001.npz
[Chunk 1] Evaluating agent with 30 rounds...
Loading model from saved state.
100%|████████████████████████████████████████████████████████████████████████████████████████████████████████████████| 30/30 [00:08<00:00,  3.44it/s]
[Chunk 1] Evaluation stats saved to agent_code/tq_optuna/dicts/eval_chunk_0001.json
Training complete.
[I 2025-08-17 16:47:56,119] Trial 22 finished with value: 3.2 and parameters: {'initial_q': -0.7194897465094006, 'learning_rate': 0.032918812288101645, 'learning_rate_mode': 'adaptive', 'discount': 0.5927512196095964}. Best is trial 4 with value: 5.133333333333334.
Loaded 50000 episodes from 1 file(s).
50000 episodes remaining. Visited 0 states
[Chunk 1] Saved single-archive snapshot to agent_code/tq_optuna/dicts/q_table_chunk_0001.npz
[Chunk 1] Evaluating agent with 30 rounds...
Loading model from saved state.
100%|████████████████████████████████████████████████████████████████████████████████████████████████████████████████| 30/30 [00:11<00:00,  2.73it/s]
[Chunk 1] Evaluation stats saved to agent_code/tq_optuna/dicts/eval_chunk_0001.json
Training complete.
[I 2025-08-17 16:49:10,251] Trial 23 finished with value: 2.033333333333333 and parameters: {'initial_q': -0.4467476085962351, 'learning_rate': 0.0017907956517765138, 'learning_rate_mode': 'fixed', 'discount': 0.5054610999244552}. Best is trial 4 with value: 5.133333333333334.
Loaded 50000 episodes from 1 file(s).
50000 episodes remaining. Visited 0 states
[Chunk 1] Saved single-archive snapshot to agent_code/tq_optuna/dicts/q_table_chunk_0001.npz
[Chunk 1] Evaluating agent with 30 rounds...
Loading model from saved state.
100%|████████████████████████████████████████████████████████████████████████████████████████████████████████████████| 30/30 [00:12<00:00,  2.40it/s]
[Chunk 1] Evaluation stats saved to agent_code/tq_optuna/dicts/eval_chunk_0001.json
Training complete.
[I 2025-08-17 16:50:33,091] Trial 24 finished with value: 4.266666666666667 and parameters: {'initial_q': -0.07145708922556687, 'learning_rate': 0.009294945561047548, 'learning_rate_mode': 'adaptive', 'discount': 0.6946067021365037}. Best is trial 4 with value: 5.133333333333334.
Loaded 50000 episodes from 1 file(s).
50000 episodes remaining. Visited 0 states
[Chunk 1] Saved single-archive snapshot to agent_code/tq_optuna/dicts/q_table_chunk_0001.npz
[Chunk 1] Evaluating agent with 30 rounds...
Loading model from saved state.
100%|████████████████████████████████████████████████████████████████████████████████████████████████████████████████| 30/30 [00:08<00:00,  3.43it/s]
[Chunk 1] Evaluation stats saved to agent_code/tq_optuna/dicts/eval_chunk_0001.json
Training complete.
[I 2025-08-17 16:51:45,596] Trial 25 finished with value: 4.933333333333334 and parameters: {'initial_q': -0.04231013292629845, 'learning_rate': 0.00879969200447028, 'learning_rate_mode': 'adaptive', 'discount': 0.8367771973241849}. Best is trial 4 with value: 5.133333333333334.
Loaded 50000 episodes from 1 file(s).
50000 episodes remaining. Visited 0 states
[Chunk 1] Saved single-archive snapshot to agent_code/tq_optuna/dicts/q_table_chunk_0001.npz
[Chunk 1] Evaluating agent with 30 rounds...
Loading model from saved state.
100%|████████████████████████████████████████████████████████████████████████████████████████████████████████████████| 30/30 [00:10<00:00,  2.82it/s]
[Chunk 1] Evaluation stats saved to agent_code/tq_optuna/dicts/eval_chunk_0001.json
Training complete.
[I 2025-08-17 16:53:02,436] Trial 26 finished with value: 5.733333333333333 and parameters: {'initial_q': -0.17205226621653585, 'learning_rate': 0.003807263980025278, 'learning_rate_mode': 'adaptive', 'discount': 0.7543426749137524}. Best is trial 26 with value: 5.733333333333333.
Loaded 50000 episodes from 1 file(s).
50000 episodes remaining. Visited 0 states
[Chunk 1] Saved single-archive snapshot to agent_code/tq_optuna/dicts/q_table_chunk_0001.npz
[Chunk 1] Evaluating agent with 30 rounds...
Loading model from saved state.
100%|████████████████████████████████████████████████████████████████████████████████████████████████████████████████| 30/30 [00:07<00:00,  4.21it/s]
[Chunk 1] Evaluation stats saved to agent_code/tq_optuna/dicts/eval_chunk_0001.json
Training complete.
