[I 2025-08-17 17:30:03,291] Trial 55 finished with value: 0.0 and parameters: {'initial_q': 0.9761456214300137, 'learning_rate': 0.012238078939222515, 'learning_rate_mode': 'fixed', 'discount': 0.8893989984846717}. Best is trial 26 with value: 5.733333333333333.
Loaded 50000 episodes from 1 file(s).
50000 episodes remaining. Visited 0 states
[Chunk 1] Saved single-archive snapshot to agent_code/tq_optuna/dicts/q_table_chunk_0001.npz
[Chunk 1] Evaluating agent with 30 rounds...
Loading model from saved state.
100%|████████████████████████████████████████████████████████████████████████████████████████████████████████████████| 30/30 [00:10<00:00,  2.99it/s]
[Chunk 1] Evaluation stats saved to agent_code/tq_optuna/dicts/eval_chunk_0001.json
Training complete.
[I 2025-08-17 17:31:19,124] Trial 56 finished with value: 3.6 and parameters: {'initial_q': -0.07541206470598297, 'learning_rate': 0.03528767933498204, 'learning_rate_mode': 'adaptive', 'discount': 0.8274090064880316}. Best is trial 26 with value: 5.733333333333333.
Loaded 50000 episodes from 1 file(s).
50000 episodes remaining. Visited 0 states
[Chunk 1] Saved single-archive snapshot to agent_code/tq_optuna/dicts/q_table_chunk_0001.npz
[Chunk 1] Evaluating agent with 30 rounds...
Loading model from saved state.
100%|████████████████████████████████████████████████████████████████████████████████████████████████████████████████| 30/30 [00:11<00:00,  2.62it/s]
[Chunk 1] Evaluation stats saved to agent_code/tq_optuna/dicts/eval_chunk_0001.json
Training complete.
[I 2025-08-17 17:32:34,992] Trial 57 finished with value: 4.066666666666666 and parameters: {'initial_q': -0.4600511698912034, 'learning_rate': 0.003047321133649668, 'learning_rate_mode': 'adaptive', 'discount': 0.5799425597783155}. Best is trial 26 with value: 5.733333333333333.
Loaded 50000 episodes from 1 file(s).
50000 episodes remaining. Visited 0 states
[Chunk 1] Saved single-archive snapshot to agent_code/tq_optuna/dicts/q_table_chunk_0001.npz
[Chunk 1] Evaluating agent with 30 rounds...
Loading model from saved state.
100%|████████████████████████████████████████████████████████████████████████████████████████████████████████████████| 30/30 [00:07<00:00,  4.02it/s]
[Chunk 1] Evaluation stats saved to agent_code/tq_optuna/dicts/eval_chunk_0001.json
Training complete.
[I 2025-08-17 17:33:47,685] Trial 58 finished with value: 2.2333333333333334 and parameters: {'initial_q': -0.6024978763758253, 'learning_rate': 0.009575643006196805, 'learning_rate_mode': 'adaptive', 'discount': 0.8443071740493262}. Best is trial 26 with value: 5.733333333333333.
Loaded 50000 episodes from 1 file(s).
50000 episodes remaining. Visited 0 states
[Chunk 1] Saved single-archive snapshot to agent_code/tq_optuna/dicts/q_table_chunk_0001.npz
[Chunk 1] Evaluating agent with 30 rounds...
Loading model from saved state.
100%|████████████████████████████████████████████████████████████████████████████████████████████████████████████████| 30/30 [00:08<00:00,  3.45it/s]
[Chunk 1] Evaluation stats saved to agent_code/tq_optuna/dicts/eval_chunk_0001.json
Training complete.
[I 2025-08-17 17:34:48,976] Trial 59 finished with value: 0.13333333333333333 and parameters: {'initial_q': 0.04094289053942485, 'learning_rate': 0.006090736899780594, 'learning_rate_mode': 'fixed', 'discount': 0.5310912117584999}. Best is trial 26 with value: 5.733333333333333.
Loaded 50000 episodes from 1 file(s).
50000 episodes remaining. Visited 0 states
[Chunk 1] Saved single-archive snapshot to agent_code/tq_optuna/dicts/q_table_chunk_0001.npz
[Chunk 1] Evaluating agent with 30 rounds...
Loading model from saved state.
100%|████████████████████████████████████████████████████████████████████████████████████████████████████████████████| 30/30 [00:12<00:00,  2.48it/s]
[Chunk 1] Evaluation stats saved to agent_code/tq_optuna/dicts/eval_chunk_0001.json
Training complete.
[I 2025-08-17 17:36:06,973] Trial 60 finished with value: 4.733333333333333 and parameters: {'initial_q': -0.12044440839097306, 'learning_rate': 1.001457746401293e-05, 'learning_rate_mode': 'adaptive', 'discount': 0.6901392061161592}. Best is trial 26 with value: 5.733333333333333.
Loaded 50000 episodes from 1 file(s).
50000 episodes remaining. Visited 0 states
[Chunk 1] Saved single-archive snapshot to agent_code/tq_optuna/dicts/q_table_chunk_0001.npz
[Chunk 1] Evaluating agent with 30 rounds...
Loading model from saved state.
100%|████████████████████████████████████████████████████████████████████████████████████████████████████████████████| 30/30 [00:10<00:00,  2.80it/s]
[Chunk 1] Evaluation stats saved to agent_code/tq_optuna/dicts/eval_chunk_0001.json
Training complete.
[I 2025-08-17 17:37:21,130] Trial 61 finished with value: 4.0 and parameters: {'initial_q': -0.18176425119983283, 'learning_rate': 0.003787969299147431, 'learning_rate_mode': 'adaptive', 'discount': 0.5461587476916879}. Best is trial 26 with value: 5.733333333333333.
Loaded 50000 episodes from 1 file(s).
50000 episodes remaining. Visited 0 states
[Chunk 1] Saved single-archive snapshot to agent_code/tq_optuna/dicts/q_table_chunk_0001.npz
[Chunk 1] Evaluating agent with 30 rounds...
Loading model from saved state.
100%|████████████████████████████████████████████████████████████████████████████████████████████████████████████████| 30/30 [00:08<00:00,  3.43it/s]
[Chunk 1] Evaluation stats saved to agent_code/tq_optuna/dicts/eval_chunk_0001.json
Training complete.
[I 2025-08-17 17:38:34,311] Trial 62 finished with value: 2.6 and parameters: {'initial_q': -0.873569674806155, 'learning_rate': 0.001674706615929812, 'learning_rate_mode': 'adaptive', 'discount': 0.6121072576542366}. Best is trial 26 with value: 5.733333333333333.
Loaded 50000 episodes from 1 file(s).
50000 episodes remaining. Visited 0 states
[Chunk 1] Saved single-archive snapshot to agent_code/tq_optuna/dicts/q_table_chunk_0001.npz
[Chunk 1] Evaluating agent with 30 rounds...
Loading model from saved state.
100%|████████████████████████████████████████████████████████████████████████████████████████████████████████████████| 30/30 [00:06<00:00,  4.51it/s]
[Chunk 1] Evaluation stats saved to agent_code/tq_optuna/dicts/eval_chunk_0001.json
Training complete.
[I 2025-08-17 17:39:45,245] Trial 63 finished with value: 2.8666666666666667 and parameters: {'initial_q': -0.8859938318739942, 'learning_rate': 0.002135944047631211, 'learning_rate_mode': 'adaptive', 'discount': 0.6539671374145789}. Best is trial 26 with value: 5.733333333333333.
Loaded 50000 episodes from 1 file(s).
50000 episodes remaining. Visited 0 states
[Chunk 1] Saved single-archive snapshot to agent_code/tq_optuna/dicts/q_table_chunk_0001.npz
[Chunk 1] Evaluating agent with 30 rounds...
Loading model from saved state.
100%|████████████████████████████████████████████████████████████████████████████████████████████████████████████████| 30/30 [00:10<00:00,  2.77it/s]
[Chunk 1] Evaluation stats saved to agent_code/tq_optuna/dicts/eval_chunk_0001.json
Training complete.
[I 2025-08-17 17:41:00,799] Trial 64 finished with value: 4.4 and parameters: {'initial_q': -0.611646374006353, 'learning_rate': 0.0012341349247006902, 'learning_rate_mode': 'adaptive', 'discount': 0.5206056225249012}. Best is trial 26 with value: 5.733333333333333.
Loaded 50000 episodes from 1 file(s).
50000 episodes remaining. Visited 0 states
[Chunk 1] Saved single-archive snapshot to agent_code/tq_optuna/dicts/q_table_chunk_0001.npz
[Chunk 1] Evaluating agent with 30 rounds...
Loading model from saved state.
100%|████████████████████████████████████████████████████████████████████████████████████████████████████████████████| 30/30 [00:06<00:00,  4.93it/s]
[Chunk 1] Evaluation stats saved to agent_code/tq_optuna/dicts/eval_chunk_0001.json
Training complete.
[I 2025-08-17 17:42:13,639] Trial 65 finished with value: 2.6666666666666665 and parameters: {'initial_q': -0.7225207827156213, 'learning_rate': 0.0005951639791996668, 'learning_rate_mode': 'adaptive', 'discount': 0.5787054906148463}. Best is trial 26 with value: 5.733333333333333.
Loaded 50000 episodes from 1 file(s).
50000 episodes remaining. Visited 0 states
[Chunk 1] Saved single-archive snapshot to agent_code/tq_optuna/dicts/q_table_chunk_0001.npz
[Chunk 1] Evaluating agent with 30 rounds...
Loading model from saved state.
100%|████████████████████████████████████████████████████████████████████████████████████████████████████████████████| 30/30 [00:10<00:00,  2.78it/s]
[Chunk 1] Evaluation stats saved to agent_code/tq_optuna/dicts/eval_chunk_0001.json
Training complete.
[I 2025-08-17 17:43:28,617] Trial 66 finished with value: 2.533333333333333 and parameters: {'initial_q': -0.3350485711025961, 'learning_rate': 0.01791491796967674, 'learning_rate_mode': 'adaptive', 'discount': 0.7999410950494744}. Best is trial 26 with value: 5.733333333333333.
Loaded 50000 episodes from 1 file(s).
50000 episodes remaining. Visited 0 states
[Chunk 1] Saved single-archive snapshot to agent_code/tq_optuna/dicts/q_table_chunk_0001.npz
[Chunk 1] Evaluating agent with 30 rounds...
Loading model from saved state.
100%|████████████████████████████████████████████████████████████████████████████████████████████████████████████████| 30/30 [00:09<00:00,  3.09it/s]
[Chunk 1] Evaluation stats saved to agent_code/tq_optuna/dicts/eval_chunk_0001.json
Training complete.
[I 2025-08-17 17:44:46,179] Trial 67 finished with value: 3.533333333333333 and parameters: {'initial_q': -0.44134381626662667, 'learning_rate': 0.008274967805346397, 'learning_rate_mode': 'adaptive', 'discount': 0.5417742818759905}. Best is trial 26 with value: 5.733333333333333.
Loaded 50000 episodes from 1 file(s).
50000 episodes remaining. Visited 0 states
[Chunk 1] Saved single-archive snapshot to agent_code/tq_optuna/dicts/q_table_chunk_0001.npz
[Chunk 1] Evaluating agent with 30 rounds...
Loading model from saved state.
100%|████████████████████████████████████████████████████████████████████████████████████████████████████████████████| 30/30 [00:11<00:00,  2.63it/s]
[Chunk 1] Evaluation stats saved to agent_code/tq_optuna/dicts/eval_chunk_0001.json
Training complete.
[I 2025-08-17 17:46:05,970] Trial 68 finished with value: 0.03333333333333333 and parameters: {'initial_q': 0.1244684877522867, 'learning_rate': 0.0022759273101011375, 'learning_rate_mode': 'adaptive', 'discount': 0.7334957697221792}. Best is trial 26 with value: 5.733333333333333.
Loaded 50000 episodes from 1 file(s).
50000 episodes remaining. Visited 0 states
[Chunk 1] Saved single-archive snapshot to agent_code/tq_optuna/dicts/q_table_chunk_0001.npz
[Chunk 1] Evaluating agent with 30 rounds...
Loading model from saved state.
100%|████████████████████████████████████████████████████████████████████████████████████████████████████████████████| 30/30 [00:08<00:00,  3.67it/s]
[Chunk 1] Evaluation stats saved to agent_code/tq_optuna/dicts/eval_chunk_0001.json
Training complete.
[I 2025-08-17 17:47:06,494] Trial 69 finished with value: 4.3 and parameters: {'initial_q': -0.2466827733931099, 'learning_rate': 2.6335455166450796e-05, 'learning_rate_mode': 'fixed', 'discount': 0.7500919437069137}. Best is trial 26 with value: 5.733333333333333.
Loaded 50000 episodes from 1 file(s).
50000 episodes remaining. Visited 0 states
[Chunk 1] Saved single-archive snapshot to agent_code/tq_optuna/dicts/q_table_chunk_0001.npz
[Chunk 1] Evaluating agent with 30 rounds...
Loading model from saved state.
100%|████████████████████████████████████████████████████████████████████████████████████████████████████████████████| 30/30 [00:08<00:00,  3.69it/s]
[Chunk 1] Evaluation stats saved to agent_code/tq_optuna/dicts/eval_chunk_0001.json
Training complete.
[I 2025-08-17 17:48:19,525] Trial 70 finished with value: 5.2 and parameters: {'initial_q': -0.027019707075197436, 'learning_rate': 0.0009087143413574294, 'learning_rate_mode': 'adaptive', 'discount': 0.8752620723243267}. Best is trial 26 with value: 5.733333333333333.
Loaded 50000 episodes from 1 file(s).
50000 episodes remaining. Visited 0 states
[Chunk 1] Saved single-archive snapshot to agent_code/tq_optuna/dicts/q_table_chunk_0001.npz
[Chunk 1] Evaluating agent with 30 rounds...
Loading model from saved state.
100%|████████████████████████████████████████████████████████████████████████████████████████████████████████████████| 30/30 [00:10<00:00,  2.73it/s]
[Chunk 1] Evaluation stats saved to agent_code/tq_optuna/dicts/eval_chunk_0001.json
Training complete.
[I 2025-08-17 17:49:34,717] Trial 71 finished with value: 3.533333333333333 and parameters: {'initial_q': -0.03484854440182003, 'learning_rate': 0.0008186923899503734, 'learning_rate_mode': 'adaptive', 'discount': 0.9642912030877704}. Best is trial 26 with value: 5.733333333333333.
Loaded 50000 episodes from 1 file(s).
50000 episodes remaining. Visited 0 states
[Chunk 1] Saved single-archive snapshot to agent_code/tq_optuna/dicts/q_table_chunk_0001.npz
[Chunk 1] Evaluating agent with 30 rounds...
Loading model from saved state.
100%|████████████████████████████████████████████████████████████████████████████████████████████████████████████████| 30/30 [00:06<00:00,  4.93it/s]
[Chunk 1] Evaluation stats saved to agent_code/tq_optuna/dicts/eval_chunk_0001.json
Training complete.
[I 2025-08-17 17:50:45,928] Trial 72 finished with value: 2.8 and parameters: {'initial_q': -0.1867883904232715, 'learning_rate': 0.000595839966527295, 'learning_rate_mode': 'adaptive', 'discount': 0.9288956607646529}. Best is trial 26 with value: 5.733333333333333.
Loaded 50000 episodes from 1 file(s).
50000 episodes remaining. Visited 0 states
[Chunk 1] Saved single-archive snapshot to agent_code/tq_optuna/dicts/q_table_chunk_0001.npz
[Chunk 1] Evaluating agent with 30 rounds...
Loading model from saved state.
100%|████████████████████████████████████████████████████████████████████████████████████████████████████████████████| 30/30 [00:10<00:00,  2.77it/s]
[Chunk 1] Evaluation stats saved to agent_code/tq_optuna/dicts/eval_chunk_0001.json
Training complete.
[I 2025-08-17 17:52:05,311] Trial 73 finished with value: 0.26666666666666666 and parameters: {'initial_q': 0.028119088825487137, 'learning_rate': 0.0043261321152041265, 'learning_rate_mode': 'adaptive', 'discount': 0.8783435040411115}. Best is trial 26 with value: 5.733333333333333.
Loaded 50000 episodes from 1 file(s).
50000 episodes remaining. Visited 0 states
[Chunk 1] Saved single-archive snapshot to agent_code/tq_optuna/dicts/q_table_chunk_0001.npz
[Chunk 1] Evaluating agent with 30 rounds...
Loading model from saved state.
100%|████████████████████████████████████████████████████████████████████████████████████████████████████████████████| 30/30 [00:10<00:00,  2.89it/s]
[Chunk 1] Evaluation stats saved to agent_code/tq_optuna/dicts/eval_chunk_0001.json
Training complete.
[I 2025-08-17 17:53:20,592] Trial 74 finished with value: 4.266666666666667 and parameters: {'initial_q': -0.08188906961049958, 'learning_rate': 0.00019450295781076754, 'learning_rate_mode': 'adaptive', 'discount': 0.5033426540649766}. Best is trial 26 with value: 5.733333333333333.
Loaded 50000 episodes from 1 file(s).
50000 episodes remaining. Visited 0 states
[Chunk 1] Saved single-archive snapshot to agent_code/tq_optuna/dicts/q_table_chunk_0001.npz
[Chunk 1] Evaluating agent with 30 rounds...
Loading model from saved state.
100%|████████████████████████████████████████████████████████████████████████████████████████████████████████████████| 30/30 [00:11<00:00,  2.71it/s]
[Chunk 1] Evaluation stats saved to agent_code/tq_optuna/dicts/eval_chunk_0001.json
Training complete.
[I 2025-08-17 17:54:34,847] Trial 75 finished with value: 0.06666666666666667 and parameters: {'initial_q': 0.21215799805648028, 'learning_rate': 0.00044408389453628956, 'learning_rate_mode': 'adaptive', 'discount': 0.8609023924245195}. Best is trial 26 with value: 5.733333333333333.
Loaded 50000 episodes from 1 file(s).
50000 episodes remaining. Visited 0 states
[Chunk 1] Saved single-archive snapshot to agent_code/tq_optuna/dicts/q_table_chunk_0001.npz
[Chunk 1] Evaluating agent with 30 rounds...
Loading model from saved state.
100%|████████████████████████████████████████████████████████████████████████████████████████████████████████████████| 30/30 [00:10<00:00,  2.98it/s]
[Chunk 1] Evaluation stats saved to agent_code/tq_optuna/dicts/eval_chunk_0001.json
Training complete.
[I 2025-08-17 17:55:49,987] Trial 76 finished with value: 2.8333333333333335 and parameters: {'initial_q': -0.28831230897745425, 'learning_rate': 0.0026933241357422833, 'learning_rate_mode': 'adaptive', 'discount': 0.7010393494522695}. Best is trial 26 with value: 5.733333333333333.
Loaded 50000 episodes from 1 file(s).
50000 episodes remaining. Visited 0 states
[Chunk 1] Saved single-archive snapshot to agent_code/tq_optuna/dicts/q_table_chunk_0001.npz
[Chunk 1] Evaluating agent with 30 rounds...
Loading model from saved state.
100%|████████████████████████████████████████████████████████████████████████████████████████████████████████████████| 30/30 [00:09<00:00,  3.23it/s]
[Chunk 1] Evaluation stats saved to agent_code/tq_optuna/dicts/eval_chunk_0001.json
Training complete.
[I 2025-08-17 17:57:05,929] Trial 77 finished with value: 5.5 and parameters: {'initial_q': -0.027184512461078406, 'learning_rate': 0.0011276777611912737, 'learning_rate_mode': 'adaptive', 'discount': 0.9099728217744126}. Best is trial 26 with value: 5.733333333333333.
Loaded 50000 episodes from 1 file(s).
50000 episodes remaining. Visited 0 states
[Chunk 1] Saved single-archive snapshot to agent_code/tq_optuna/dicts/q_table_chunk_0001.npz
[Chunk 1] Evaluating agent with 30 rounds...
Loading model from saved state.
100%|████████████████████████████████████████████████████████████████████████████████████████████████████████████████| 30/30 [00:10<00:00,  2.92it/s]
[Chunk 1] Evaluation stats saved to agent_code/tq_optuna/dicts/eval_chunk_0001.json
Training complete.
[I 2025-08-17 17:58:21,647] Trial 78 finished with value: 0.6 and parameters: {'initial_q': 0.10221534397997628, 'learning_rate': 0.00037383545391375726, 'learning_rate_mode': 'adaptive', 'discount': 0.881337721215923}. Best is trial 26 with value: 5.733333333333333.
Loaded 50000 episodes from 1 file(s).
50000 episodes remaining. Visited 0 states
[Chunk 1] Saved single-archive snapshot to agent_code/tq_optuna/dicts/q_table_chunk_0001.npz
[Chunk 1] Evaluating agent with 30 rounds...
Loading model from saved state.
100%|████████████████████████████████████████████████████████████████████████████████████████████████████████████████| 30/30 [00:09<00:00,  3.01it/s]
[Chunk 1] Evaluation stats saved to agent_code/tq_optuna/dicts/eval_chunk_0001.json
Training complete.
[I 2025-08-17 17:59:36,106] Trial 79 finished with value: 3.2 and parameters: {'initial_q': -0.01998320276440831, 'learning_rate': 0.02864871896649719, 'learning_rate_mode': 'adaptive', 'discount': 0.916047906719711}. Best is trial 26 with value: 5.733333333333333.
Loaded 50000 episodes from 1 file(s).
50000 episodes remaining. Visited 0 states
[Chunk 1] Saved single-archive snapshot to agent_code/tq_optuna/dicts/q_table_chunk_0001.npz
[Chunk 1] Evaluating agent with 30 rounds...
Loading model from saved state.
100%|████████████████████████████████████████████████████████████████████████████████████████████████████████████████| 30/30 [00:09<00:00,  3.18it/s]
[Chunk 1] Evaluation stats saved to agent_code/tq_optuna/dicts/eval_chunk_0001.json
Training complete.
[I 2025-08-17 18:00:53,096] Trial 80 finished with value: 2.9 and parameters: {'initial_q': -0.12062353245921972, 'learning_rate': 0.0011115614346341306, 'learning_rate_mode': 'adaptive', 'discount': 0.9489153315892018}. Best is trial 26 with value: 5.733333333333333.
Loaded 50000 episodes from 1 file(s).
50000 episodes remaining. Visited 0 states
[Chunk 1] Saved single-archive snapshot to agent_code/tq_optuna/dicts/q_table_chunk_0001.npz
[Chunk 1] Evaluating agent with 30 rounds...
Loading model from saved state.
100%|████████████████████████████████████████████████████████████████████████████████████████████████████████████████| 30/30 [00:08<00:00,  3.37it/s]
[Chunk 1] Evaluation stats saved to agent_code/tq_optuna/dicts/eval_chunk_0001.json
Training complete.
[I 2025-08-17 18:02:08,966] Trial 81 finished with value: 2.8 and parameters: {'initial_q': -0.16347007297104807, 'learning_rate': 0.0018255452026136182, 'learning_rate_mode': 'adaptive', 'discount': 0.8996024108281196}. Best is trial 26 with value: 5.733333333333333.
Loaded 50000 episodes from 1 file(s).
50000 episodes remaining. Visited 0 states
[Chunk 1] Saved single-archive snapshot to agent_code/tq_optuna/dicts/q_table_chunk_0001.npz
[Chunk 1] Evaluating agent with 30 rounds...
Loading model from saved state.
100%|████████████████████████████████████████████████████████████████████████████████████████████████████████████████| 30/30 [00:06<00:00,  4.60it/s]
[Chunk 1] Evaluation stats saved to agent_code/tq_optuna/dicts/eval_chunk_0001.json
Training complete.
[I 2025-08-17 18:03:25,213] Trial 82 finished with value: 2.8666666666666667 and parameters: {'initial_q': -0.22337026262694423, 'learning_rate': 0.0007966999217119097, 'learning_rate_mode': 'adaptive', 'discount': 0.9704334319662922}. Best is trial 26 with value: 5.733333333333333.
Loaded 50000 episodes from 1 file(s).
50000 episodes remaining. Visited 0 states
[Chunk 1] Saved single-archive snapshot to agent_code/tq_optuna/dicts/q_table_chunk_0001.npz
[Chunk 1] Evaluating agent with 30 rounds...
Loading model from saved state.
100%|████████████████████████████████████████████████████████████████████████████████████████████████████████████████| 30/30 [00:08<00:00,  3.34it/s]
[Chunk 1] Evaluation stats saved to agent_code/tq_optuna/dicts/eval_chunk_0001.json
Training complete.
