[I 2025-08-17 18:04:41,097] Trial 83 finished with value: 4.0 and parameters: {'initial_q': -0.07004064924812424, 'learning_rate': 0.014915491529579702, 'learning_rate_mode': 'adaptive', 'discount': 0.9368927862551337}. Best is trial 26 with value: 5.733333333333333.
Loaded 50000 episodes from 1 file(s).
50000 episodes remaining. Visited 0 states
[Chunk 1] Saved single-archive snapshot to agent_code/tq_optuna/dicts/q_table_chunk_0001.npz
[Chunk 1] Evaluating agent with 30 rounds...
Loading model from saved state.
100%|████████████████████████████████████████████████████████████████████████████████████████████████████████████████| 30/30 [00:10<00:00,  2.85it/s]
[Chunk 1] Evaluation stats saved to agent_code/tq_optuna/dicts/eval_chunk_0001.json
Training complete.
[I 2025-08-17 18:05:56,481] Trial 84 finished with value: 0.3 and parameters: {'initial_q': 0.028595488824000787, 'learning_rate': 0.007674696606590214, 'learning_rate_mode': 'adaptive', 'discount': 0.7714527454165157}. Best is trial 26 with value: 5.733333333333333.
Loaded 50000 episodes from 1 file(s).
50000 episodes remaining. Visited 0 states
[Chunk 1] Saved single-archive snapshot to agent_code/tq_optuna/dicts/q_table_chunk_0001.npz
[Chunk 1] Evaluating agent with 30 rounds...
Loading model from saved state.
100%|████████████████████████████████████████████████████████████████████████████████████████████████████████████████| 30/30 [00:08<00:00,  3.51it/s]
[Chunk 1] Evaluation stats saved to agent_code/tq_optuna/dicts/eval_chunk_0001.json
Training complete.
[I 2025-08-17 18:07:09,726] Trial 85 finished with value: 0.23333333333333334 and parameters: {'initial_q': 0.061355218282962365, 'learning_rate': 0.0037372908523011553, 'learning_rate_mode': 'adaptive', 'discount': 0.5570423123813948}. Best is trial 26 with value: 5.733333333333333.
Loaded 50000 episodes from 1 file(s).
50000 episodes remaining. Visited 0 states
[Chunk 1] Saved single-archive snapshot to agent_code/tq_optuna/dicts/q_table_chunk_0001.npz
[Chunk 1] Evaluating agent with 30 rounds...
Loading model from saved state.
100%|████████████████████████████████████████████████████████████████████████████████████████████████████████████████| 30/30 [00:09<00:00,  3.10it/s]
[Chunk 1] Evaluation stats saved to agent_code/tq_optuna/dicts/eval_chunk_0001.json
Training complete.
[I 2025-08-17 18:08:26,238] Trial 86 finished with value: 0.1 and parameters: {'initial_q': 0.24445924766659707, 'learning_rate': 0.0014794539772334948, 'learning_rate_mode': 'adaptive', 'discount': 0.9115227858129998}. Best is trial 26 with value: 5.733333333333333.
Loaded 50000 episodes from 1 file(s).
50000 episodes remaining. Visited 0 states
[Chunk 1] Saved single-archive snapshot to agent_code/tq_optuna/dicts/q_table_chunk_0001.npz
[Chunk 1] Evaluating agent with 30 rounds...
Loading model from saved state.
100%|████████████████████████████████████████████████████████████████████████████████████████████████████████████████| 30/30 [00:05<00:00,  5.52it/s]
[Chunk 1] Evaluation stats saved to agent_code/tq_optuna/dicts/eval_chunk_0001.json
Training complete.
[I 2025-08-17 18:09:24,381] Trial 87 finished with value: 6.233333333333333 and parameters: {'initial_q': -0.42536811010797076, 'learning_rate': 0.019220669522827652, 'learning_rate_mode': 'fixed', 'discount': 0.8241842124605607}. Best is trial 87 with value: 6.233333333333333.
Loaded 50000 episodes from 1 file(s).
50000 episodes remaining. Visited 0 states
[Chunk 1] Saved single-archive snapshot to agent_code/tq_optuna/dicts/q_table_chunk_0001.npz
[Chunk 1] Evaluating agent with 30 rounds...
Loading model from saved state.
100%|████████████████████████████████████████████████████████████████████████████████████████████████████████████████| 30/30 [00:07<00:00,  3.92it/s]
[Chunk 1] Evaluation stats saved to agent_code/tq_optuna/dicts/eval_chunk_0001.json
Training complete.
[I 2025-08-17 18:10:25,472] Trial 88 finished with value: 3.5 and parameters: {'initial_q': -0.41189889673347396, 'learning_rate': 0.019097893196037125, 'learning_rate_mode': 'fixed', 'discount': 0.8443889685996815}. Best is trial 87 with value: 6.233333333333333.
Loaded 50000 episodes from 1 file(s).
50000 episodes remaining. Visited 0 states
[Chunk 1] Saved single-archive snapshot to agent_code/tq_optuna/dicts/q_table_chunk_0001.npz
[Chunk 1] Evaluating agent with 30 rounds...
Loading model from saved state.
100%|████████████████████████████████████████████████████████████████████████████████████████████████████████████████| 30/30 [00:08<00:00,  3.59it/s]
[Chunk 1] Evaluation stats saved to agent_code/tq_optuna/dicts/eval_chunk_0001.json
Training complete.
[I 2025-08-17 18:11:28,860] Trial 89 finished with value: 6.133333333333334 and parameters: {'initial_q': -0.2719078005789809, 'learning_rate': 0.012154283460051773, 'learning_rate_mode': 'fixed', 'discount': 0.8174318204232238}. Best is trial 87 with value: 6.233333333333333.
Loaded 50000 episodes from 1 file(s).
50000 episodes remaining. Visited 0 states
[Chunk 1] Saved single-archive snapshot to agent_code/tq_optuna/dicts/q_table_chunk_0001.npz
[Chunk 1] Evaluating agent with 30 rounds...
Loading model from saved state.
100%|████████████████████████████████████████████████████████████████████████████████████████████████████████████████| 30/30 [00:06<00:00,  4.47it/s]
[Chunk 1] Evaluation stats saved to agent_code/tq_optuna/dicts/eval_chunk_0001.json
Training complete.
[I 2025-08-17 18:12:28,651] Trial 90 finished with value: 5.7 and parameters: {'initial_q': -0.2744683292115445, 'learning_rate': 0.012393871040068569, 'learning_rate_mode': 'fixed', 'discount': 0.7863237865666852}. Best is trial 87 with value: 6.233333333333333.
Loaded 50000 episodes from 1 file(s).
50000 episodes remaining. Visited 0 states
[Chunk 1] Saved single-archive snapshot to agent_code/tq_optuna/dicts/q_table_chunk_0001.npz
[Chunk 1] Evaluating agent with 30 rounds...
Loading model from saved state.
100%|████████████████████████████████████████████████████████████████████████████████████████████████████████████████| 30/30 [00:05<00:00,  5.16it/s]
[Chunk 1] Evaluation stats saved to agent_code/tq_optuna/dicts/eval_chunk_0001.json
Training complete.
[I 2025-08-17 18:13:26,342] Trial 91 finished with value: 4.0 and parameters: {'initial_q': -0.35806810219287605, 'learning_rate': 0.043085611025822125, 'learning_rate_mode': 'fixed', 'discount': 0.7864439690414504}. Best is trial 87 with value: 6.233333333333333.
Loaded 50000 episodes from 1 file(s).
50000 episodes remaining. Visited 0 states
[Chunk 1] Saved single-archive snapshot to agent_code/tq_optuna/dicts/q_table_chunk_0001.npz
[Chunk 1] Evaluating agent with 30 rounds...
Loading model from saved state.
100%|████████████████████████████████████████████████████████████████████████████████████████████████████████████████| 30/30 [00:06<00:00,  4.87it/s]
[Chunk 1] Evaluation stats saved to agent_code/tq_optuna/dicts/eval_chunk_0001.json
Training complete.
[I 2025-08-17 18:14:26,150] Trial 92 finished with value: 5.866666666666666 and parameters: {'initial_q': -0.5482791686711113, 'learning_rate': 0.013251781606975795, 'learning_rate_mode': 'fixed', 'discount': 0.7935188723003765}. Best is trial 87 with value: 6.233333333333333.
Loaded 50000 episodes from 1 file(s).
50000 episodes remaining. Visited 0 states
[Chunk 1] Saved single-archive snapshot to agent_code/tq_optuna/dicts/q_table_chunk_0001.npz
[Chunk 1] Evaluating agent with 30 rounds...
Loading model from saved state.
100%|████████████████████████████████████████████████████████████████████████████████████████████████████████████████| 30/30 [00:11<00:00,  2.60it/s]
[Chunk 1] Evaluation stats saved to agent_code/tq_optuna/dicts/eval_chunk_0001.json
Training complete.
[I 2025-08-17 18:15:34,835] Trial 93 finished with value: 5.033333333333333 and parameters: {'initial_q': -0.5225346623766609, 'learning_rate': 0.013564632074148451, 'learning_rate_mode': 'fixed', 'discount': 0.8198247319870953}. Best is trial 87 with value: 6.233333333333333.
Loaded 50000 episodes from 1 file(s).
50000 episodes remaining. Visited 0 states
[Chunk 1] Saved single-archive snapshot to agent_code/tq_optuna/dicts/q_table_chunk_0001.npz
[Chunk 1] Evaluating agent with 30 rounds...
Loading model from saved state.
100%|████████████████████████████████████████████████████████████████████████████████████████████████████████████████| 30/30 [00:07<00:00,  4.00it/s]
[Chunk 1] Evaluation stats saved to agent_code/tq_optuna/dicts/eval_chunk_0001.json
Training complete.
[I 2025-08-17 18:16:36,136] Trial 94 finished with value: 5.533333333333333 and parameters: {'initial_q': -0.4551232303908085, 'learning_rate': 0.021335782634061204, 'learning_rate_mode': 'fixed', 'discount': 0.7959948275701342}. Best is trial 87 with value: 6.233333333333333.
Loaded 50000 episodes from 1 file(s).
50000 episodes remaining. Visited 0 states
[Chunk 1] Saved single-archive snapshot to agent_code/tq_optuna/dicts/q_table_chunk_0001.npz
[Chunk 1] Evaluating agent with 30 rounds...
Loading model from saved state.
100%|████████████████████████████████████████████████████████████████████████████████████████████████████████████████| 30/30 [00:10<00:00,  2.79it/s]
[Chunk 1] Evaluation stats saved to agent_code/tq_optuna/dicts/eval_chunk_0001.json
Training complete.
[I 2025-08-17 18:17:40,132] Trial 95 finished with value: 3.1666666666666665 and parameters: {'initial_q': -0.47499491341640065, 'learning_rate': 0.06933256818767472, 'learning_rate_mode': 'fixed', 'discount': 0.7978633002514643}. Best is trial 87 with value: 6.233333333333333.
Loaded 50000 episodes from 1 file(s).
50000 episodes remaining. Visited 0 states
[Chunk 1] Saved single-archive snapshot to agent_code/tq_optuna/dicts/q_table_chunk_0001.npz
[Chunk 1] Evaluating agent with 30 rounds...
Loading model from saved state.
100%|████████████████████████████████████████████████████████████████████████████████████████████████████████████████| 30/30 [00:09<00:00,  3.26it/s]
[Chunk 1] Evaluation stats saved to agent_code/tq_optuna/dicts/eval_chunk_0001.json
Training complete.
[I 2025-08-17 18:18:41,958] Trial 96 finished with value: 3.8 and parameters: {'initial_q': -0.5807040202822087, 'learning_rate': 0.03276083447346359, 'learning_rate_mode': 'fixed', 'discount': 0.8144621416405681}. Best is trial 87 with value: 6.233333333333333.
Loaded 50000 episodes from 1 file(s).
50000 episodes remaining. Visited 0 states
[Chunk 1] Saved single-archive snapshot to agent_code/tq_optuna/dicts/q_table_chunk_0001.npz
[Chunk 1] Evaluating agent with 30 rounds...
Loading model from saved state.
100%|████████████████████████████████████████████████████████████████████████████████████████████████████████████████| 30/30 [00:07<00:00,  3.79it/s]
[Chunk 1] Evaluation stats saved to agent_code/tq_optuna/dicts/eval_chunk_0001.json
Training complete.
[I 2025-08-17 18:19:42,316] Trial 97 finished with value: 5.933333333333334 and parameters: {'initial_q': -0.5532746669372857, 'learning_rate': 0.01962267028832926, 'learning_rate_mode': 'fixed', 'discount': 0.7867614886972837}. Best is trial 87 with value: 6.233333333333333.
Loaded 50000 episodes from 1 file(s).
50000 episodes remaining. Visited 0 states
[Chunk 1] Saved single-archive snapshot to agent_code/tq_optuna/dicts/q_table_chunk_0001.npz
[Chunk 1] Evaluating agent with 30 rounds...
Loading model from saved state.
100%|████████████████████████████████████████████████████████████████████████████████████████████████████████████████| 30/30 [00:08<00:00,  3.40it/s]
[Chunk 1] Evaluation stats saved to agent_code/tq_optuna/dicts/eval_chunk_0001.json
Training complete.
[I 2025-08-17 18:20:43,644] Trial 98 finished with value: 6.333333333333333 and parameters: {'initial_q': -0.6340190163036856, 'learning_rate': 0.02191789644515872, 'learning_rate_mode': 'fixed', 'discount': 0.7774798361133805}. Best is trial 98 with value: 6.333333333333333.
Loaded 50000 episodes from 1 file(s).
50000 episodes remaining. Visited 0 states
[Chunk 1] Saved single-archive snapshot to agent_code/tq_optuna/dicts/q_table_chunk_0001.npz
[Chunk 1] Evaluating agent with 30 rounds...
Loading model from saved state.
100%|████████████████████████████████████████████████████████████████████████████████████████████████████████████████| 30/30 [00:09<00:00,  3.21it/s]
[Chunk 1] Evaluation stats saved to agent_code/tq_optuna/dicts/eval_chunk_0001.json
Training complete.
[I 2025-08-17 18:21:45,427] Trial 99 finished with value: 6.5 and parameters: {'initial_q': -0.6374781608899868, 'learning_rate': 0.021974521773962988, 'learning_rate_mode': 'fixed', 'discount': 0.7603525592096564}. Best is trial 99 with value: 6.5.
Best trial:
FrozenTrial(number=99, state=TrialState.COMPLETE, values=[6.5], datetime_start=datetime.datetime(2025, 8, 17, 18, 20, 43, 644934), datetime_complete=datetime.datetime(2025, 8, 17, 18, 21, 45, 427267), params={'initial_q': -0.6374781608899868, 'learning_rate': 0.021974521773962988, 'learning_rate_mode': 'fixed', 'discount': 0.7603525592096564}, user_attrs={}, system_attrs={}, intermediate_values={}, distributions={'initial_q': FloatDistribution(high=1.0, log=False, low=-1.0, step=None), 'learning_rate': FloatDistribution(high=0.1, log=True, low=1e-05, step=None), 'learning_rate_mode': CategoricalDistribution(choices=('fixed', 'adaptive')), 'discount': FloatDistribution(high=0.99, log=False, low=0.5, step=None)}, trial_id=99, value=None)

Best params:
initial_q: -0.6374781608899868
learning_rate: 0.021974521773962988
learning_rate_mode: fixed
discount: 0.7603525592096564
```

### Code


```
#!/usr/bin/env python3
import optuna
import subprocess
import os
import json
import pickle
import shutil
import tempfile
import numpy as np

DICT_FOLDER = "optuna"
MAIN_SCRIPT = "q_pretrain_tabular.py"

def run_training(params):
    output_q_file = "agent_code/tq_optuna/q_table.npz"

    cmd = [
        "python3", MAIN_SCRIPT,
        "--transitions-file", "agent_code/tq_demonstrator/runs/three_rule_based_peaceful_50k_18bit/transitions.pkl",  # Change as needed
        "--output-q-file", output_q_file,
        "--training-episodes", "50000",
        "--num-chunks", "1",
        "--evaluate",
        "--agents", "tq_optuna", "rule_based_agent", "rule_based_agent", "peaceful_agent",
        "--scenario", "classic",
        "--eval-rounds", "30",
        "--initial-q", str(params["initial_q"]),
        "--learning-rate", str(params["learning_rate"]),
        "--learning-rate-mode", params["learning_rate_mode"],
        "--discount", str(params["discount"])
    ]

    subprocess.run(cmd, check=True)
    return

def evaluate_last_json(dict_folder, agent_name="tq_optuna"):
    json_files = sorted(
        [f for f in os.listdir(dict_folder) if f.startswith("eval_chunk_") and f.endswith(".json")]
    )
    if not json_files:
        raise FileNotFoundError("No evaluation JSONs found.")

    last_json_path = os.path.join(dict_folder, json_files[-1])
    with open(last_json_path, "r") as f:
        data = json.load(f)

    agent_data = data["by_agent"].get(agent_name)
    if agent_data is None:
        raise ValueError(f"Agent '{agent_name}' not found in {last_json_path}")


    score = agent_data.get("score", 0)
    rounds = agent_data.get("rounds", 1)
    avg_score = score / rounds
    return avg_score


def objective(trial):
    # Define search space
    params = {
        "initial_q": trial.suggest_float("initial_q", -1.0, 1.0),
        "learning_rate": trial.suggest_float("learning_rate", 1e-5, 1e-1, log=True),
        "learning_rate_mode": trial.suggest_categorical("learning_rate_mode", ["fixed", "adaptive"]),
        "discount": trial.suggest_float("discount", 0.5, 0.99)
    }

    try:
        dict_folder = run_training(params)
        score = evaluate_last_json("agent_code/tq_optuna/dicts")
        return score
    except Exception as e:
        print(f"Trial {trial.number} failed: {e}")
        return float("-inf")

def main():
    os.makedirs(DICT_FOLDER, exist_ok=True)

    study = optuna.create_study(direction="maximize")
    study.optimize(objective, n_trials=100)

    print("Best trial:")
    print(study.best_trial)

    print("\nBest params:")
    for key, val in study.best_trial.params.items():
        print(f"{key}: {val}")
    import pickle

    with open("optuna_study.pkl", "wb") as f:
        pickle.dump(study, f)

if __name__ == "__main__":
    main()
```