[I 2025-08-17 16:54:14,142] Trial 27 finished with value: 0.23333333333333334 and parameters: {'initial_q': 0.054890349307413766, 'learning_rate': 0.004368201932036581, 'learning_rate_mode': 'adaptive', 'discount': 0.8344243855667819}. Best is trial 26 with value: 5.733333333333333.
Loaded 50000 episodes from 1 file(s).
50000 episodes remaining. Visited 0 states
[Chunk 1] Saved single-archive snapshot to agent_code/tq_optuna/dicts/q_table_chunk_0001.npz
[Chunk 1] Evaluating agent with 30 rounds...
Loading model from saved state.
100%|████████████████████████████████████████████████████████████████████████████████████████████████████████████████| 30/30 [00:06<00:00,  4.72it/s]
[Chunk 1] Evaluation stats saved to agent_code/tq_optuna/dicts/eval_chunk_0001.json
Training complete.
[I 2025-08-17 16:55:23,581] Trial 28 finished with value: 4.266666666666667 and parameters: {'initial_q': -0.19821059596730567, 'learning_rate': 0.017137956349603082, 'learning_rate_mode': 'adaptive', 'discount': 0.7551213158578417}. Best is trial 26 with value: 5.733333333333333.
Loaded 50000 episodes from 1 file(s).
50000 episodes remaining. Visited 0 states
[Chunk 1] Saved single-archive snapshot to agent_code/tq_optuna/dicts/q_table_chunk_0001.npz
[Chunk 1] Evaluating agent with 30 rounds...
Loading model from saved state.
100%|████████████████████████████████████████████████████████████████████████████████████████████████████████████████| 30/30 [00:11<00:00,  2.53it/s]
[Chunk 1] Evaluation stats saved to agent_code/tq_optuna/dicts/eval_chunk_0001.json
Training complete.
[I 2025-08-17 16:56:46,750] Trial 29 finished with value: 0.13333333333333333 and parameters: {'initial_q': 0.09500009185777117, 'learning_rate': 0.0004367464028400191, 'learning_rate_mode': 'adaptive', 'discount': 0.7408050466648765}. Best is trial 26 with value: 5.733333333333333.
Loaded 50000 episodes from 1 file(s).
50000 episodes remaining. Visited 0 states
[Chunk 1] Saved single-archive snapshot to agent_code/tq_optuna/dicts/q_table_chunk_0001.npz
[Chunk 1] Evaluating agent with 30 rounds...
Loading model from saved state.
100%|████████████████████████████████████████████████████████████████████████████████████████████████████████████████| 30/30 [00:14<00:00,  2.10it/s]
[Chunk 1] Evaluation stats saved to agent_code/tq_optuna/dicts/eval_chunk_0001.json
Training complete.
[I 2025-08-17 16:58:32,858] Trial 30 finished with value: 0.3333333333333333 and parameters: {'initial_q': 0.19494734104298356, 'learning_rate': 5.262920213981719e-05, 'learning_rate_mode': 'adaptive', 'discount': 0.8299846878073253}. Best is trial 26 with value: 5.733333333333333.
Loaded 50000 episodes from 1 file(s).
50000 episodes remaining. Visited 0 states
[Chunk 1] Saved single-archive snapshot to agent_code/tq_optuna/dicts/q_table_chunk_0001.npz
[Chunk 1] Evaluating agent with 30 rounds...
Loading model from saved state.
100%|████████████████████████████████████████████████████████████████████████████████████████████████████████████████| 30/30 [00:06<00:00,  4.54it/s]
[Chunk 1] Evaluation stats saved to agent_code/tq_optuna/dicts/eval_chunk_0001.json
Training complete.
[I 2025-08-17 16:59:52,589] Trial 31 finished with value: 1.6333333333333333 and parameters: {'initial_q': -0.3880208037585456, 'learning_rate': 0.0023841079796485085, 'learning_rate_mode': 'adaptive', 'discount': 0.8547499619246844}. Best is trial 26 with value: 5.733333333333333.
Loaded 50000 episodes from 1 file(s).
50000 episodes remaining. Visited 0 states
[Chunk 1] Saved single-archive snapshot to agent_code/tq_optuna/dicts/q_table_chunk_0001.npz
[Chunk 1] Evaluating agent with 30 rounds...
Loading model from saved state.
100%|████████████████████████████████████████████████████████████████████████████████████████████████████████████████| 30/30 [00:10<00:00,  2.88it/s]
[Chunk 1] Evaluation stats saved to agent_code/tq_optuna/dicts/eval_chunk_0001.json
Training complete.
[I 2025-08-17 17:01:09,995] Trial 32 finished with value: 5.133333333333334 and parameters: {'initial_q': -0.09875768089644657, 'learning_rate': 0.005376827740755299, 'learning_rate_mode': 'adaptive', 'discount': 0.7216889386855432}. Best is trial 26 with value: 5.733333333333333.
Loaded 50000 episodes from 1 file(s).
50000 episodes remaining. Visited 0 states
[Chunk 1] Saved single-archive snapshot to agent_code/tq_optuna/dicts/q_table_chunk_0001.npz
[Chunk 1] Evaluating agent with 30 rounds...
Loading model from saved state.
100%|████████████████████████████████████████████████████████████████████████████████████████████████████████████████| 30/30 [00:12<00:00,  2.36it/s]
[Chunk 1] Evaluation stats saved to agent_code/tq_optuna/dicts/eval_chunk_0001.json
Training complete.
[I 2025-08-17 17:02:27,809] Trial 33 finished with value: 5.4 and parameters: {'initial_q': -0.13303223234063657, 'learning_rate': 0.006017329250022943, 'learning_rate_mode': 'adaptive', 'discount': 0.7234770097618008}. Best is trial 26 with value: 5.733333333333333.
Loaded 50000 episodes from 1 file(s).
50000 episodes remaining. Visited 0 states
[Chunk 1] Saved single-archive snapshot to agent_code/tq_optuna/dicts/q_table_chunk_0001.npz
[Chunk 1] Evaluating agent with 30 rounds...
Loading model from saved state.
100%|████████████████████████████████████████████████████████████████████████████████████████████████████████████████| 30/30 [00:10<00:00,  2.77it/s]
[Chunk 1] Evaluation stats saved to agent_code/tq_optuna/dicts/eval_chunk_0001.json
Training complete.
[I 2025-08-17 17:03:46,857] Trial 34 finished with value: 3.966666666666667 and parameters: {'initial_q': -0.14642600901931074, 'learning_rate': 0.00451229499090023, 'learning_rate_mode': 'adaptive', 'discount': 0.7369176174944737}. Best is trial 26 with value: 5.733333333333333.
Loaded 50000 episodes from 1 file(s).
50000 episodes remaining. Visited 0 states
[Chunk 1] Saved single-archive snapshot to agent_code/tq_optuna/dicts/q_table_chunk_0001.npz
[Chunk 1] Evaluating agent with 30 rounds...
Loading model from saved state.
100%|████████████████████████████████████████████████████████████████████████████████████████████████████████████████| 30/30 [00:13<00:00,  2.20it/s]
[Chunk 1] Evaluation stats saved to agent_code/tq_optuna/dicts/eval_chunk_0001.json
Training complete.
[I 2025-08-17 17:05:12,305] Trial 35 finished with value: 0.0 and parameters: {'initial_q': 0.3434985265129338, 'learning_rate': 0.0012524438151348771, 'learning_rate_mode': 'adaptive', 'discount': 0.7256019726959773}. Best is trial 26 with value: 5.733333333333333.
Loaded 50000 episodes from 1 file(s).
50000 episodes remaining. Visited 0 states
[Chunk 1] Saved single-archive snapshot to agent_code/tq_optuna/dicts/q_table_chunk_0001.npz
[Chunk 1] Evaluating agent with 30 rounds...
Loading model from saved state.
100%|████████████████████████████████████████████████████████████████████████████████████████████████████████████████| 30/30 [00:09<00:00,  3.23it/s]
[Chunk 1] Evaluation stats saved to agent_code/tq_optuna/dicts/eval_chunk_0001.json
Training complete.
[I 2025-08-17 17:06:25,134] Trial 36 finished with value: 3.8333333333333335 and parameters: {'initial_q': -0.22973855959547052, 'learning_rate': 0.00718067137345896, 'learning_rate_mode': 'adaptive', 'discount': 0.6353913933047742}. Best is trial 26 with value: 5.733333333333333.
Loaded 50000 episodes from 1 file(s).
50000 episodes remaining. Visited 0 states
[Chunk 1] Saved single-archive snapshot to agent_code/tq_optuna/dicts/q_table_chunk_0001.npz
[Chunk 1] Evaluating agent with 30 rounds...
Loading model from saved state.
100%|████████████████████████████████████████████████████████████████████████████████████████████████████████████████| 30/30 [00:10<00:00,  2.83it/s]
[Chunk 1] Evaluation stats saved to agent_code/tq_optuna/dicts/eval_chunk_0001.json
Training complete.
[I 2025-08-17 17:07:40,304] Trial 37 finished with value: 0.1 and parameters: {'initial_q': 0.16901253479393152, 'learning_rate': 0.0009002950611973965, 'learning_rate_mode': 'adaptive', 'discount': 0.7747508521556212}. Best is trial 26 with value: 5.733333333333333.
Loaded 50000 episodes from 1 file(s).
50000 episodes remaining. Visited 0 states
[Chunk 1] Saved single-archive snapshot to agent_code/tq_optuna/dicts/q_table_chunk_0001.npz
[Chunk 1] Evaluating agent with 30 rounds...
Loading model from saved state.
100%|████████████████████████████████████████████████████████████████████████████████████████████████████████████████| 30/30 [00:15<00:00,  1.94it/s]
[Chunk 1] Evaluation stats saved to agent_code/tq_optuna/dicts/eval_chunk_0001.json
Training complete.
[I 2025-08-17 17:09:07,933] Trial 38 finished with value: 2.933333333333333 and parameters: {'initial_q': -0.36325848670173577, 'learning_rate': 0.024525297211124873, 'learning_rate_mode': 'adaptive', 'discount': 0.6697858675651399}. Best is trial 26 with value: 5.733333333333333.
Loaded 50000 episodes from 1 file(s).
50000 episodes remaining. Visited 0 states
[Chunk 1] Saved single-archive snapshot to agent_code/tq_optuna/dicts/q_table_chunk_0001.npz
[Chunk 1] Evaluating agent with 30 rounds...
Loading model from saved state.
100%|████████████████████████████████████████████████████████████████████████████████████████████████████████████████| 30/30 [00:11<00:00,  2.57it/s]
[Chunk 1] Evaluation stats saved to agent_code/tq_optuna/dicts/eval_chunk_0001.json
Training complete.
[I 2025-08-17 17:10:29,935] Trial 39 finished with value: 4.5 and parameters: {'initial_q': -0.01630955780007673, 'learning_rate': 0.0033751214043618153, 'learning_rate_mode': 'adaptive', 'discount': 0.7111395349085243}. Best is trial 26 with value: 5.733333333333333.
Loaded 50000 episodes from 1 file(s).
50000 episodes remaining. Visited 0 states
[Chunk 1] Saved single-archive snapshot to agent_code/tq_optuna/dicts/q_table_chunk_0001.npz
[Chunk 1] Evaluating agent with 30 rounds...
Loading model from saved state.
100%|████████████████████████████████████████████████████████████████████████████████████████████████████████████████| 30/30 [00:09<00:00,  3.02it/s]
[Chunk 1] Evaluation stats saved to agent_code/tq_optuna/dicts/eval_chunk_0001.json
Training complete.
[I 2025-08-17 17:11:52,920] Trial 40 finished with value: 0.23333333333333334 and parameters: {'initial_q': 0.32411164672335313, 'learning_rate': 0.053110652258692444, 'learning_rate_mode': 'adaptive', 'discount': 0.8122221986725601}. Best is trial 26 with value: 5.733333333333333.
Loaded 50000 episodes from 1 file(s).
50000 episodes remaining. Visited 0 states
[Chunk 1] Saved single-archive snapshot to agent_code/tq_optuna/dicts/q_table_chunk_0001.npz
[Chunk 1] Evaluating agent with 30 rounds...
Loading model from saved state.
100%|████████████████████████████████████████████████████████████████████████████████████████████████████████████████| 30/30 [00:11<00:00,  2.66it/s]
[Chunk 1] Evaluation stats saved to agent_code/tq_optuna/dicts/eval_chunk_0001.json
Training complete.
[I 2025-08-17 17:13:12,191] Trial 41 finished with value: 4.633333333333334 and parameters: {'initial_q': -0.03873394211080223, 'learning_rate': 0.010844718984057382, 'learning_rate_mode': 'adaptive', 'discount': 0.9086006639884955}. Best is trial 26 with value: 5.733333333333333.
Loaded 50000 episodes from 1 file(s).
50000 episodes remaining. Visited 0 states
[Chunk 1] Saved single-archive snapshot to agent_code/tq_optuna/dicts/q_table_chunk_0001.npz
[Chunk 1] Evaluating agent with 30 rounds...
Loading model from saved state.
100%|████████████████████████████████████████████████████████████████████████████████████████████████████████████████| 30/30 [00:07<00:00,  3.75it/s]
[Chunk 1] Evaluation stats saved to agent_code/tq_optuna/dicts/eval_chunk_0001.json
Training complete.
[I 2025-08-17 17:14:26,202] Trial 42 finished with value: 2.0 and parameters: {'initial_q': -0.1586701599143024, 'learning_rate': 0.00717221114364659, 'learning_rate_mode': 'adaptive', 'discount': 0.866078396743412}. Best is trial 26 with value: 5.733333333333333.
Loaded 50000 episodes from 1 file(s).
50000 episodes remaining. Visited 0 states
[Chunk 1] Saved single-archive snapshot to agent_code/tq_optuna/dicts/q_table_chunk_0001.npz
[Chunk 1] Evaluating agent with 30 rounds...
Loading model from saved state.
100%|████████████████████████████████████████████████████████████████████████████████████████████████████████████████| 30/30 [00:06<00:00,  4.64it/s]
[Chunk 1] Evaluation stats saved to agent_code/tq_optuna/dicts/eval_chunk_0001.json
Training complete.
[I 2025-08-17 17:15:40,296] Trial 43 finished with value: 4.233333333333333 and parameters: {'initial_q': -0.268397522730765, 'learning_rate': 0.006281050862424627, 'learning_rate_mode': 'adaptive', 'discount': 0.7864440748844446}. Best is trial 26 with value: 5.733333333333333.
Loaded 50000 episodes from 1 file(s).
50000 episodes remaining. Visited 0 states
[Chunk 1] Saved single-archive snapshot to agent_code/tq_optuna/dicts/q_table_chunk_0001.npz
[Chunk 1] Evaluating agent with 30 rounds...
Loading model from saved state.
100%|████████████████████████████████████████████████████████████████████████████████████████████████████████████████| 30/30 [00:06<00:00,  4.42it/s]
[Chunk 1] Evaluation stats saved to agent_code/tq_optuna/dicts/eval_chunk_0001.json
Training complete.
[I 2025-08-17 17:16:51,486] Trial 44 finished with value: 5.033333333333333 and parameters: {'initial_q': -0.08694316467631356, 'learning_rate': 0.011385598505447228, 'learning_rate_mode': 'adaptive', 'discount': 0.9446741317573829}. Best is trial 26 with value: 5.733333333333333.
Loaded 50000 episodes from 1 file(s).
50000 episodes remaining. Visited 0 states
[Chunk 1] Saved single-archive snapshot to agent_code/tq_optuna/dicts/q_table_chunk_0001.npz
[Chunk 1] Evaluating agent with 30 rounds...
Loading model from saved state.
100%|████████████████████████████████████████████████████████████████████████████████████████████████████████████████| 30/30 [00:09<00:00,  3.28it/s]
[Chunk 1] Evaluation stats saved to agent_code/tq_optuna/dicts/eval_chunk_0001.json
Training complete.
[I 2025-08-17 17:18:08,017] Trial 45 finished with value: 3.1333333333333333 and parameters: {'initial_q': 0.07277586532420044, 'learning_rate': 0.013443304100259958, 'learning_rate_mode': 'adaptive', 'discount': 0.9863578039926981}. Best is trial 26 with value: 5.733333333333333.
Loaded 50000 episodes from 1 file(s).
50000 episodes remaining. Visited 0 states
[Chunk 1] Saved single-archive snapshot to agent_code/tq_optuna/dicts/q_table_chunk_0001.npz
[Chunk 1] Evaluating agent with 30 rounds...
Loading model from saved state.
100%|████████████████████████████████████████████████████████████████████████████████████████████████████████████████| 30/30 [00:09<00:00,  3.15it/s]
[Chunk 1] Evaluation stats saved to agent_code/tq_optuna/dicts/eval_chunk_0001.json
Training complete.
[I 2025-08-17 17:19:22,359] Trial 46 finished with value: 2.2666666666666666 and parameters: {'initial_q': -0.5958661289764677, 'learning_rate': 0.023551100123263478, 'learning_rate_mode': 'adaptive', 'discount': 0.95802202158416}. Best is trial 26 with value: 5.733333333333333.
Loaded 50000 episodes from 1 file(s).
50000 episodes remaining. Visited 0 states
[Chunk 1] Saved single-archive snapshot to agent_code/tq_optuna/dicts/q_table_chunk_0001.npz
[Chunk 1] Evaluating agent with 30 rounds...
Loading model from saved state.
100%|████████████████████████████████████████████████████████████████████████████████████████████████████████████████| 30/30 [00:11<00:00,  2.61it/s]
[Chunk 1] Evaluation stats saved to agent_code/tq_optuna/dicts/eval_chunk_0001.json
Training complete.
[I 2025-08-17 17:20:25,974] Trial 47 finished with value: 4.1 and parameters: {'initial_q': -0.38740736296688255, 'learning_rate': 0.005529050104016446, 'learning_rate_mode': 'fixed', 'discount': 0.9232182583420527}. Best is trial 26 with value: 5.733333333333333.
Loaded 50000 episodes from 1 file(s).
50000 episodes remaining. Visited 0 states
[Chunk 1] Saved single-archive snapshot to agent_code/tq_optuna/dicts/q_table_chunk_0001.npz
[Chunk 1] Evaluating agent with 30 rounds...
Loading model from saved state.
100%|████████████████████████████████████████████████████████████████████████████████████████████████████████████████| 30/30 [00:07<00:00,  4.03it/s]
[Chunk 1] Evaluation stats saved to agent_code/tq_optuna/dicts/eval_chunk_0001.json
Training complete.
[I 2025-08-17 17:21:37,728] Trial 48 finished with value: 2.533333333333333 and parameters: {'initial_q': -0.22966264253107171, 'learning_rate': 0.0028861923727090686, 'learning_rate_mode': 'adaptive', 'discount': 0.8939540527452443}. Best is trial 26 with value: 5.733333333333333.
Loaded 50000 episodes from 1 file(s).
50000 episodes remaining. Visited 0 states
[Chunk 1] Saved single-archive snapshot to agent_code/tq_optuna/dicts/q_table_chunk_0001.npz
[Chunk 1] Evaluating agent with 30 rounds...
Loading model from saved state.
100%|████████████████████████████████████████████████████████████████████████████████████████████████████████████████| 30/30 [00:08<00:00,  3.44it/s]
[Chunk 1] Evaluation stats saved to agent_code/tq_optuna/dicts/eval_chunk_0001.json
Training complete.
[I 2025-08-17 17:22:50,609] Trial 49 finished with value: 0.03333333333333333 and parameters: {'initial_q': 0.48858161548795986, 'learning_rate': 0.0014954909935212452, 'learning_rate_mode': 'adaptive', 'discount': 0.6267415931122305}. Best is trial 26 with value: 5.733333333333333.
Loaded 50000 episodes from 1 file(s).
50000 episodes remaining. Visited 0 states
[Chunk 1] Saved single-archive snapshot to agent_code/tq_optuna/dicts/q_table_chunk_0001.npz
[Chunk 1] Evaluating agent with 30 rounds...
Loading model from saved state.
100%|████████████████████████████████████████████████████████████████████████████████████████████████████████████████| 30/30 [00:09<00:00,  3.08it/s]
[Chunk 1] Evaluation stats saved to agent_code/tq_optuna/dicts/eval_chunk_0001.json
Training complete.
[I 2025-08-17 17:24:05,528] Trial 50 finished with value: 2.8 and parameters: {'initial_q': -0.10322320238975065, 'learning_rate': 0.06115324957165039, 'learning_rate_mode': 'adaptive', 'discount': 0.6738914287804412}. Best is trial 26 with value: 5.733333333333333.
Loaded 50000 episodes from 1 file(s).
50000 episodes remaining. Visited 0 states
[Chunk 1] Saved single-archive snapshot to agent_code/tq_optuna/dicts/q_table_chunk_0001.npz
[Chunk 1] Evaluating agent with 30 rounds...
Loading model from saved state.
100%|████████████████████████████████████████████████████████████████████████████████████████████████████████████████| 30/30 [00:08<00:00,  3.75it/s]
[Chunk 1] Evaluation stats saved to agent_code/tq_optuna/dicts/eval_chunk_0001.json
Training complete.
[I 2025-08-17 17:25:19,006] Trial 51 finished with value: 2.7333333333333334 and parameters: {'initial_q': 0.005996349777140947, 'learning_rate': 0.010937635017127231, 'learning_rate_mode': 'adaptive', 'discount': 0.805536350163205}. Best is trial 26 with value: 5.733333333333333.
Loaded 50000 episodes from 1 file(s).
50000 episodes remaining. Visited 0 states
[Chunk 1] Saved single-archive snapshot to agent_code/tq_optuna/dicts/q_table_chunk_0001.npz
[Chunk 1] Evaluating agent with 30 rounds...
Loading model from saved state.
100%|████████████████████████████████████████████████████████████████████████████████████████████████████████████████| 30/30 [00:10<00:00,  2.80it/s]
[Chunk 1] Evaluation stats saved to agent_code/tq_optuna/dicts/eval_chunk_0001.json
Training complete.
[I 2025-08-17 17:26:35,836] Trial 52 finished with value: 0.9666666666666667 and parameters: {'initial_q': 0.14742151008106846, 'learning_rate': 0.017704603812323208, 'learning_rate_mode': 'adaptive', 'discount': 0.9492734071495009}. Best is trial 26 with value: 5.733333333333333.
Loaded 50000 episodes from 1 file(s).
50000 episodes remaining. Visited 0 states
[Chunk 1] Saved single-archive snapshot to agent_code/tq_optuna/dicts/q_table_chunk_0001.npz
[Chunk 1] Evaluating agent with 30 rounds...
Loading model from saved state.
100%|████████████████████████████████████████████████████████████████████████████████████████████████████████████████| 30/30 [00:07<00:00,  3.84it/s]
[Chunk 1] Evaluation stats saved to agent_code/tq_optuna/dicts/eval_chunk_0001.json
Training complete.
[I 2025-08-17 17:27:48,123] Trial 53 finished with value: 0.0 and parameters: {'initial_q': 0.2629883368846789, 'learning_rate': 0.025412022207129813, 'learning_rate_mode': 'adaptive', 'discount': 0.7149811583492317}. Best is trial 26 with value: 5.733333333333333.
Loaded 50000 episodes from 1 file(s).
50000 episodes remaining. Visited 0 states
[Chunk 1] Saved single-archive snapshot to agent_code/tq_optuna/dicts/q_table_chunk_0001.npz
[Chunk 1] Evaluating agent with 30 rounds...
Loading model from saved state.
100%|████████████████████████████████████████████████████████████████████████████████████████████████████████████████| 30/30 [00:05<00:00,  5.15it/s]
[Chunk 1] Evaluation stats saved to agent_code/tq_optuna/dicts/eval_chunk_0001.json
Training complete.
[I 2025-08-17 17:28:59,559] Trial 54 finished with value: 3.2333333333333334 and parameters: {'initial_q': -0.31228531155732014, 'learning_rate': 0.005016078691737827, 'learning_rate_mode': 'adaptive', 'discount': 0.761002408545542}. Best is trial 26 with value: 5.733333333333333.
Loaded 50000 episodes from 1 file(s).
50000 episodes remaining. Visited 0 states
[Chunk 1] Saved single-archive snapshot to agent_code/tq_optuna/dicts/q_table_chunk_0001.npz
[Chunk 1] Evaluating agent with 30 rounds...
Loading model from saved state.
100%|████████████████████████████████████████████████████████████████████████████████████████████████████████████████| 30/30 [00:09<00:00,  3.06it/s]
[Chunk 1] Evaluation stats saved to agent_code/tq_optuna/dicts/eval_chunk_0001.json
Training complete.
